{
  "$schema": "http://json-schema.org/draft-07/schema#",
  "$id": "run_state.schema.json",
  "title": "Run State",
  "description": "Orchestrator çıktısı — çalıştırma durumu, aşama bazlı süre/token/doğrulama kaydı.",
  "type": "object",
  "required": ["run_id", "status", "stages"],
  "additionalProperties": false,
  "properties": {
    "run_id": { "type": "string" },
    "status": {
      "type": "string",
      "enum": ["pending", "running", "completed", "failed", "needs_review"]
    },
    "started_at": { "type": ["string", "null"] },
    "finished_at": { "type": ["string", "null"] },
    "stages": {
      "type": "array",
      "items": {
        "type": "object",
        "required": ["agent", "status"],
        "additionalProperties": false,
        "properties": {
          "agent": {
            "type": "string",
            "enum": ["intelligence", "strategy", "market", "campaign"]
          },
          "status": {
            "type": "string",
            "enum": ["pending", "running", "completed", "failed", "needs_review"]
          },
          "started_at": { "type": ["string", "null"] },
          "finished_at": { "type": ["string", "null"] },
          "tokens": {
            "type": "object",
            "additionalProperties": false,
            "properties": {
              "input": { "type": "integer", "minimum": 0 },
              "output": { "type": "integer", "minimum": 0 },
              "total": { "type": "integer", "minimum": 0 }
            }
          },
          "latency_ms": { "type": ["number", "null"], "minimum": 0 },
          "attempts": { "type": "integer", "minimum": 0 },
          "validation_passed": { "type": "boolean" },
          "error": { "type": ["string", "null"] }
        }
      }
    }
  }
}
