{
  "run_id": "run_demo_0001",
  "status": "completed",
  "started_at": "2026-06-11T00:00:00Z",
  "finished_at": "2026-06-11T00:03:42Z",
  "stages": [
    {
      "agent": "intelligence",
      "status": "completed",
      "started_at": "2026-06-11T00:00:00Z",
      "finished_at": "2026-06-11T00:01:10Z",
      "tokens": { "input": 48200, "output": 3100, "total": 51300 },
      "latency_ms": 70120,
      "attempts": 1,
      "validation_passed": true,
      "error": null
    },
    {
      "agent": "strategy",
      "status": "completed",
      "started_at": "2026-06-11T00:01:10Z",
      "finished_at": "2026-06-11T00:02:18Z",
      "tokens": { "input": 9400, "output": 4200, "total": 13600 },
      "latency_ms": 68340,
      "attempts": 2,
      "validation_passed": true,
      "error": null
    },
    {
      "agent": "market",
      "status": "completed",
      "started_at": "2026-06-11T00:02:18Z",
      "finished_at": "2026-06-11T00:03:05Z",
      "tokens": { "input": 6100, "output": 2900, "total": 9000 },
      "latency_ms": 47010,
      "attempts": 1,
      "validation_passed": true,
      "error": null
    },
    {
      "agent": "campaign",
      "status": "completed",
      "started_at": "2026-06-11T00:03:05Z",
      "finished_at": "2026-06-11T00:03:42Z",
      "tokens": { "input": 5300, "output": 3600, "total": 8900 },
      "latency_ms": 37220,
      "attempts": 1,
      "validation_passed": true,
      "error": null
    }
  ]
}
